<?xml version="1.0" encoding="UTF-8"?>
<!--
To change this license header, choose License Headers in Project Properties.
To change this template file, choose Tools | Templates
and open the template in the editor.
-->


<persona
    xmlns:xsi='http://www.w3.org/2001/XMLSchema-instance'
    xsi:noNamespaceSchemaLocation='XSD.xsd'>
    <nombre>Alejandro</nombre>
    <nombre>Martin</nombre>
  
    <apellido>Perez</apellido>
    <apellido>Sotelo</apellido>
    <!--FORMATO DATE AÃ‘O/MES/DIA -->
    <fechanacimiento>2000-09-24</fechanacimiento>
    <numerodocumento>1111111</numerodocumento>
    <trianero>1</trianero>

</persona>
